ulasan,rasa,sambal,keramaian,kenyamanan,pelayanan,rating,sentimen
Restoran kesukaan kita yaitu dione dim sum pelayanan sangat memuaskan cepat dan makanan nya enak tidak mengecewakan,BAGUS,NETRAL,NETRAL,BAGUS,BAGUS,5,1
Restoran yang menyajikan masakan indonesia...terutama ayam goreng atau bakar tulang lunak..favofitku ayam goreng telur asin..rasa nya enak banget.untuk soal harga seh termasuk murah dan ada nasi uduk nya juga..pantas untuk di coba..,BAGUS,NETRAL,NETRAL,NETRAL,NETRAL,5,1
"Restorannya bersih sekali, suka makan disini",NETRAL,NETRAL,NETRAL,BAGUS,NETRAL,4,1
Ribut banget,NETRAL,NETRAL,NETRAL,BURUK,BURUK,2,0
Ridiculously overpriced!,NETRAL,NETRAL,NETRAL,BURUK,NETRAL,1,0
Rindu mau datang lagi,NETRAL,NETRAL,NETRAL,BAGUS,NETRAL,5,1
"Ruangan makan sangat berisik, para pelayan asik sendiri",NETRAL,NETRAL,NETRAL,BURUK,BURUK,2,0
"Ruangan makan sangat panas, hanya menggunakan kipas angin",NETRAL,NETRAL,NETRAL,BURUK,BURUK,2,0
"Ruangan panas sekali, hanya menyediakan kipas angin. Padahal sekarang cuaca sedang panas",BURUK,BURUK,BURUK,BURUK,BURUK,1,0
"ruangnya smoking area semua, jd kalo tamunya pd ngerokok kita jadi ikutan berasep",NETRAL,NETRAL,NETRAL,BURUK,BURUK,1,0
Rude services,NETRAL,NETRAL,NETRAL,BURUK,BURUK,1,0
Rugi besar makan di sini,BURUK,NETRAL,NETRAL,BURUK,BURUK,2,0
Rumah makan nya kurang bersih,NETRAL,NETRAL,NETRAL,BURUK,NETRAL,1,0
Rumah makan paling dicari di Batam,NETRAL,NETRAL,NETRAL,BAGUS,BAGUS,5,1
"Rumah makan sangat adem, jadi betah makan disini",NETRAL,NETRAL,NETRAL,BAGUS,BAGUS,4,1
"Rumah makan sedang tidak penuh, meminta kursi bayi saja tidak diberikan. ketika sudah duduk, pelayan tidak menawarkan minuman ataupun makanan yang mereka sediakan. sungguh kecewa",NETRAL,NETRAL,BURUK,BURUK,BURUK,1,0
Rumah makan terbaik di Batam,NETRAL,NETRAL,NETRAL,BAGUS,BAGUS,5,1
Rumah makannya bersih,NETRAL,NETRAL,NETRAL,BAGUS,BAGUS,5,1
"Rumah makannya kotor, sehingga tidak nyaman ketika makan",NETRAL,NETRAL,NETRAL,BURUK,NETRAL,1,0
"salah satu gelato terfavorit, sekali beli pasti kalo ga size medium, ya size large (4 flavours). biar lokasinya jauh dari rumah, tetep dibelain mampir untuk beli ini, wkwk",BAGUS,NETRAL,NETRAL,NETRAL,NETRAL,4,1
Salah satu resto fav saya di Batam. Makanan mereka sangat enak. Favorite saya ikan bandeng dan ayam penyet. benar2 enak. nasi mereka juga harus. tidak biasanya restoran menyediakan beras dengan kualitas yang baik,BAGUS,NETRAL,NETRAL,BAGUS,BAGUS,5,1
"Salah satu tempat makan favorite di batam centre, kalian harus coba karna makanan nya cukup enak dan tempatnya cukup enak",BAGUS,NETRAL,NETRAL,BAGUS,NETRAL,5,1
"Sambal nya bikin nagih, mau makan terus",BAGUS,BAGUS,NETRAL,BAGUS,NETRAL,5,1
"Sambal nya gak higienis,gak dicuci cabe nya,langsung di ulek aja abis dikeluarin dr karung,setiap abis makan dari sini perut saya sakit, ikan nya bau amis,jorok tempatnya dan gak sehat !",BURUK,BURUK,NETRAL,BURUK,NETRAL,1,0
Sambal nya tidak terlalu pedas tapi cukup. ayam yang disajikan juga masih fresh tidak seperti ayam bekuan yang sudah lama,BAGUS,BAGUS,NETRAL,NETRAL,NETRAL,4,1
"Sambal nya wangi sekali, sangat suka makan disini",BAGUS,BAGUS,NETRAL,NETRAL,NETRAL,5,1
Sambal segar,NETRAL,BAGUS,NETRAL,BAGUS,NETRAL,4,1
Sambal terbaik yang pernah saya makan!!,BAGUS,BAGUS,NETRAL,NETRAL,NETRAL,5,1
"Sambal yang diberikan sedikit sekali, padahal harganya lumayan mahal",NETRAL,BURUK,NETRAL,NETRAL,BURUK,1,0
Sambalnya b aja sih,NETRAL,NETRAL,NETRAL,NETRAL,NETRAL,3,0
Sambalnya biasa aja,NETRAL,NETRAL,NETRAL,NETRAL,NETRAL,3,0
"Sambalnya enak banget, pas jadi cocolan",NETRAL,BAGUS,NETRAL,BAGUS,BAGUS,5,1
"Sambalnya keasinan, tidak enak",BURUK,BURUK,NETRAL,NETRAL,NETRAL,1,0
Sambalnya kurang pedas dan terlalu manis,BURUK,BURUK,NETRAL,NETRAL,NETRAL,2,0
Sambalnya nendang,NETRAL,BAGUS,NETRAL,NETRAL,NETRAL,5,1
Sambalnya rasanya pas,NETRAL,BAGUS,NETRAL,NETRAL,NETRAL,5,1
"Sampe ga tau mau komentar apa tentang perpaduan nasi uduk dan ayam goreng nya si Mat Lengket ini. Best nasi uduk ayam goreng in Jakarta! AYamnya ayam kampung, walau kecil, tapi rasanya enak banget!",BAGUS,NETRAL,NETRAL,NETRAL,NETRAL,5,1
"sangat kecewa dengan pelayanan, pelayannya sangat tidak ramah. pelayanannya sangat mengecewakan !! tolong diperbaiki kualitas pelayanannya.",NETRAL,NETRAL,NETRAL,BURUK,BURUK,1,0
"Sangat kecewa, boss nya tidak ramah dan tidak sopan",NETRAL,NETRAL,NETRAL,BURUK,BURUK,2,0
Sangat Lezat,BAGUS,NETRAL,NETRAL,NETRAL,NETRAL,5,1
Sangat memanjakan customer,NETRAL,NETRAL,NETRAL,BAGUS,BAGUS,5,1
Sarapan disini mantep. Tempatnya nyaman. Lg ada diskon pula. Bersih jg . Ini sumpit jg dimasukin ke air panas. Bersih deh pkoknya,NETRAL,NETRAL,NETRAL,BAGUS,BAGUS,4,1
Sarapan disini mantep. Tempatnya nyaman. Lg ada diskon pula. Bersih jg . Ini sumpit jg dimasukin ke air panas. Bersih deh pkoknya,BAGUS,NETRAL,NETRAL,BAGUS,BAGUS,5,1
"Sate disini empuk, dagingnya nggak alot dan chewy-able. Bumbunya juga pas dan pedes. Trus pake bawang goreng on top. Sungguh kenikmatan yang HQQ!",BAGUS,NETRAL,NETRAL,NETRAL,NETRAL,5,1
Sate usus + sate lidahnya enak ( MANTUL ),BAGUS,NETRAL,NETRAL,NETRAL,NETRAL,4,1
Satu porsi ga cukup,BAGUS,NETRAL,NETRAL,BAGUS,NETRAL,5,1
"Saya dilayani dengan baik sekali, salut",NETRAL,NETRAL,NETRAL,NETRAL,BAGUS,4,1
"Saya kesini pas bukber Semua makanannya terhidang ga panas alias dingin.. cuma nasinya doang yg panas.. payah ah untuk restaurant sebesar ini pelayanannya kurang, keteteran pula dengan pesanan yg banyak, waitressnya bilang udah dihidangkan tapi padahal belum",BURUK,NETRAL,NETRAL,BURUK,BURUK,2,0
"Saya kesini pas bukber Semua makanannya terhidang ga panas alias dingin.. cuma nasinya doang yg panas.. payah ah untuk restaurant sebesar ini pelayanannya kurang, keteteran pula dengan pesanan yg banyak, waitressnya bilang udah dihidangkan tapi padahal belum",BURUK,NETRAL,NETRAL,BURUK,BURUK,1,0
"Saya kira bakalan enak, ternyata mengecewakan sekali",BURUK,BURUK,NETRAL,BURUK,BURUK,1,0
"Saya malam ini makan nasi bakwan sama kuah. harga sup ikan dengan pajak sekitar 40rb an, dengan jumlah ikan seperti di foto belum di sentuh. Mana kuahnya asin banget minta ampun sampe pait?? tolong yang masak di jagain dong jangan kaya gini???? padahal mungkin kalau ga se asin itu rasanya lumayan, ini ga bisa dimakan??",BURUK,NETRAL,NETRAL,NETRAL,NETRAL,1,0
"Saya melihat untuk driver ojek online tidak dilayani dengan baik, sangat kecewa. mereka juga pelanggan",NETRAL,NETRAL,NETRAL,NETRAL,BURUK,2,0
"Saya orang Kediri, sudah lama tidak pulang kesana. Setelah makan di restoran ini rasanya enak banget! Seperti masakan ibu saya",BAGUS,NETRAL,NETRAL,NETRAL,NETRAL,5,1
"Saya pelanggan yang memesan melalui gofood, walaupun tidak langsung kerumah makannya. saya bisa merasakan pelayanan yang maksimal dari tempat ini. makanan yang saya terima telah dibungkus dengan ketat dan membuat saya yakin kalau restoran ini aman",NETRAL,NETRAL,NETRAL,BAGUS,BAGUS,5,1
"Saya pesan ayam penyet dan nasi, ternyata nasi putihnya tidak matang dengan sempurna. ini pengalaman pertama saya dan sudah memberikan kesan yang buruk!",BURUK,NETRAL,NETRAL,NETRAL,BURUK,2,0
"saya pesan ayam penyet, nasi goreng kampung dan nasi bakar teri. makanan kurang rasa, pesan nasi bakar teri tidak ada terinya. pesan es teh tawar tidak keluar tapi tetap ditagih dan waiter nya ngotot. cukup kecewa untuk restoran sebesar ini.",BURUK,NETRAL,NETRAL,BURUK,BURUK,2,0
"Saya pesan nasi bali yang nunggu makanannya hampir 1 jam, dengan rasa makanan yang benar2 standar dengan harga 80rb, tapi bisa dilihat di foto kualitas makanannya (tinggal dipanasin doang). Padahal ratingnya sangat tinggi sekali di zomato. Bukan hanya itu saja, parahnya lagi ada staples di makanan teman saya, untung saja terlihat & tidak termakan...",BURUK,NETRAL,NETRAL,BURUK,BURUK,2,0
"Saya rasa tempat yang ramai seharusnya tidak dijadikan alsan untuk pengunjung mentoleransi keterlambatan keluarnya makanan, saya menunggu 1 jam lebih dan saya perlu datangi staff di resto dan saya tu ggu di sebelah staff nya sampai makanan keluar

Saya sudah protes lebih dari 3x, namun tidak ditanggapi dengan serius, saat makanan leluar pun, banyak kesalahan, spt sambal dan ikan yang tidak sesuai.

Saya sangat kecewa karena saya dari jakarta Ke bogor untuk mencoba resto ini.

Juga, hati2 dengan bill nya tidak sesuai.",BURUK,BURUK,NETRAL,BURUK,BURUK,1,0
"sayang banget nih nyusahin banget. jd gue mau pesen dr grab, tp karna dr pihak resto belum update harga jd kerepotan sendiri abang grabnya. kan kasian sama grabnya.",NETRAL,NETRAL,NETRAL,BURUK,BURUK,1,0
"seafood disni gada lawan. semua enak gada pengecualian. cm tmpt nya panas dan krg bersih

harga : 8/10
tempat : 6/10
rasa : 10/10
kebersihan : 5/10",BAGUS,NETRAL,NETRAL,BURUK,NETRAL,5,1
"Seafood enak yang pricey tapi emang worth parah
Seafood nya beuh tiap gigitannya selalu merasa ini kenapa enak banget dah :((
Wajib coba gaes kepiting soka nya",BAGUS,NETRAL,NETRAL,NETRAL,NETRAL,5,1
Seafood rasa surga,BAGUS,NETRAL,NETRAL,NETRAL,NETRAL,4,1
"Seafood terenak di Jakarta dengan vibes yang cukup menyenangkan. Walaupun penuh, pelayanan cepat dan ramah. Udang lada hitam terenak, wajib coba!",BAGUS,NETRAL,NETRAL,NETRAL,NETRAL,5,1
"Sebenarnya saya sudah bbrp kali kesini dan memang selalu lama dapet makanannya . Tapi hari minggu yang lalu setelah nunggu 1.5 jam baru makanan dtg. Padahal org2 yg dtg stlh saya bs dpt duluan. Menurut saya makanannya udah biasa aja, apalagi dg waktu menunggu yg keterlaluan. Blm lagi pelayan2 wanitanya kebanyakan cm bengong2 g jelas.
Saya pesan air kelapa, tp g diksh sekalian sm gulanya. Stlh diminta baru dianter. Pesanan air kelapa sy diantar oleh pelayan wanita yg kelihatan kesal krn dia salah ngasih pesanan sy ke meja yg lain. Mgkn dia sdh muter2 cari kmn pesanan hrs diantar, tp kan it's not my problem. Sendok garpu g diksh, stlh diminta, baru diksh, itupun oleh pelayan laki2 yg sy minta ssdhnya. Buat saya cukup deh utk makan ketempat ini. It's not so special and not delicious enough deh.",NETRAL,NETRAL,NETRAL,BURUK,BURUK,1,0
"Sebenarnya udh sering ke sini. Tiap ke tmpt ini prsennya pasti ayam telor asin. Rasanya sih enak.banget ga boong.
Mesti cobain jg tahu telornya",BAGUS,NETRAL,NETRAL,NETRAL,NETRAL,5,1
"Sebenernya makananny enak. Tapi mereka selalu tidak mampu melayani dengan baik pada saat pengunjung membludak. Antrean ga jelas, (buat dong kaya sushi tei yang jelas terpampang di layar), mau pesen dan daftar waiting list pelayannya aja sibuk sendiri, udah duduk di usir karena katanya ga waiting list dulu (lha mana pelayanan yang info ke kita tempat waiting list dlsb), kita cuma berdua dibanding lainnya yang dateng ber lima belas akhirnya keluar ga jadi makan. Masukan saja supaya diperbaiki sistim antrean pada saat sangat ramai. Saya dua kali datang kesana dalam keadaa ramai dan sangat2 tidak nyaman dan karena hari ini sangat berantakan jadi kami putuskan pulang saja.",BAGUS,NETRAL,BURUK,BURUK,BURUK,1,0
Sedap makanannya,BAGUS,NETRAL,NETRAL,BAGUS,NETRAL,5,1
Sedikit pilihan menunya,NETRAL,NETRAL,NETRAL,BURUK,NETRAL,2,0
Sedikit variasi menu,NETRAL,NETRAL,NETRAL,BURUK,NETRAL,1,0
"Sejauh ini makanannya enak2 aja.
SATU YANG KURANG : pelayanannya kurang tanggap bgt ??
Kami minta beresin meja bekas makan orang sebelumnya, lamaaaaa pisan.
Makanannya lamaaaaa bgt jg datangnya. (Padahl yg dipesan juga bukan menu yg neko2)
Minta tambahan minuman, lamaaaaaa juga datangnya.
Pelayannya cuma bilang ""iya""2 aja dan kebanyakan dari mereka lebih sering terlihat di dapur. Bukan nyebar.

Ga ngerti lagi w.",BAGUS,NETRAL,NETRAL,BURUK,BURUK,3,0
Selalu ada promosi,NETRAL,NETRAL,NETRAL,BAGUS,BAGUS,5,1
"Selalu beli mix daging dan lidah. Bumbu siramnya mayan pedes, tapi enak banget. Biasa bumbu sate padang itu agak kekuningan, kalo ini lebih agak coklat.",BAGUS,NETRAL,NETRAL,NETRAL,NETRAL,5,1
Selalu consistent rasa saosnya! Dan empuk dagingnya.,BAGUS,NETRAL,NETRAL,NETRAL,NETRAL,4,1
"Selalu kesini buat makan waffle- nya yang jadi jagoan, tempat nya enak buat makan dan nongkrong sekaligus jadi gag perlu pindah tempat.",BAGUS,NETRAL,NETRAL,BAGUS,BAGUS,5,1
"Selalu mengedepankan citarasa, rasa belum hijrah sejak pertama kali saya nongkrong disini.
pelayanannya lumayan sigap",BAGUS,NETRAL,NETRAL,NETRAL,NETRAL,5,1
Selalu menjadi tempat favorite,NETRAL,NETRAL,NETRAL,BAGUS,BAGUS,5,1
selalu pesan sate lidahnya..Empukkkk bgt dan menurutku bumbunya pas. Jangan lupa kerupuk kulit disiram bumbu satenya,BAGUS,NETRAL,NETRAL,NETRAL,NETRAL,4,1
"Selalu puas makan di gyu kaku, thanks mb fitri untuk pelayan nya, stiap kita nambh sellu cepet, untuk suasana nya asik ditmbh ada musiknya juga,,, untuk staf"" nya pada ramah senyum walaupun pakai masker ??",BAGUS,NETRAL,NETRAL,BAGUS,BAGUS,5,1
Selama makan di gyukaku moi tidak pernah merasa kecewa karena pilihan daging yg selalu fresh dan mantap,BAGUS,NETRAL,NETRAL,NETRAL,NETRAL,4,1
"Semua ayamnya lembut, enak, dan gurih",BAGUS,NETRAL,NETRAL,NETRAL,NETRAL,5,1
Semuanya enak guys!!!!,BAGUS,BAGUS,NETRAL,BAGUS,BAGUS,4,1
"Semuanya enak terutama siomay sm hakau, udangnya fresh bngt tpi sayangnya bakpao telor asinnya big no",BAGUS,NETRAL,NETRAL,NETRAL,NETRAL,5,1
"Semuanya lama.

Makanannya baru keluar 1,5 jam setelah dipesan. Makanan yang datang juga sudah dingin dan kering. Bell untuk waiter juga entah tidak berfungsi atau berfungsi tapi tidak ada waiter yang datang.
Bill pun juga lama datangnya sampai kita akhirnya datang ke kasir.",NETRAL,NETRAL,NETRAL,BURUK,BURUK,1,0
Semuanya memuaskan,BAGUS,BAGUS,BAGUS,BAGUS,BAGUS,4,1
Senang bisa datang kemari lagi,NETRAL,NETRAL,NETRAL,NETRAL,NETRAL,4,1
"Senang sekali! Bebas Parkir dengan gratis dan luas, merayakan hari ibu disini adalah keputusan yang tepat",NETRAL,NETRAL,NETRAL,BAGUS,BAGUS,5,1
seneng banget makan disini selain staffnya ramah banget terus semua bersih banget yahhh tempatnya juga cozy dan cerah. makanannya fresh sekali daaan rasanya enak. dia ada plate kan ya walaupun plate yg yellow cuman 10rb rasanya enak ga mengecewakan ??,BAGUS,NETRAL,NETRAL,BAGUS,BAGUS,5,1
Seperti restoran hotel bintang lima,NETRAL,NETRAL,NETRAL,BAGUS,BAGUS,5,1
Sepertinya ini kali pertama dan kali terakhir saya kesini,BURUK,BURUK,BURUK,BURUK,BURUK,1,0
Sering makan disini. Enak2 smua. Tempat cozy dan bersih. Dan buka sampe malem.,BAGUS,NETRAL,NETRAL,BAGUS,BAGUS,5,1
Service jelek banget. Order iced tea and iced chocolate lebih dari 40 menit diantar setelah 3 kali tanya. Dikasih spaghetti pesanan tapi tidak diberi sendok/garpu. Again need to ask but still it takes so long. Padahal resto nya bagus. Tp sucks,NETRAL,NETRAL,NETRAL,BURUK,BURUK,1,0
"Service nya buruk sekali! Pilih paket ayce 99rb tunggu lama sekali & harus minta berkali2 baru daging & minum diantar itupun masi kurang saus, mash potato & nasi. Alat grill gosong jadi baru dipakai sebentar rasa daging jadi pahit. Beberapa kali pelayannya salah bawa pesanan. Gagal banget konsep ayce disini, baru kali ini makan ayce 99rb tp ngerasa rugiiiiii. Fyi gw udh nyoba makan di bbrp resto serupa tapi service disini paling buruk",NETRAL,BURUK,NETRAL,BURUK,BURUK,1,0
"Service pelayanannya bagus oleh mas rian, makanan cepat keluar, emang ga pernah mengecewakan makan di gyukaku",NETRAL,NETRAL,NETRAL,BAGUS,BAGUS,5,1
"Servicenya kurang memuaskan , masa cuman minta air putih saja tidak di kasih , padahal ada panggil Cocktail juga , kecuali tidak panggil minum baru boleh ga di kasih air putih",NETRAL,NETRAL,NETRAL,BURUK,BURUK,1,0
"Servisnya mengecewakan. Dua meja dilayani duluan padahal mereka datang belakangan. Setelah menunggu sekitar 45 menit pesanan teman saya baru datang, dan waktu dia hampir selesai makan barulah pesanan saya datang. Jadi sekitar 1 jam deh menunggu Entah bagaimana sistem di dapurnya sehingga orang-orang yg datang belakangan bisa lebih dulu dibuatkan pesanannya.",NETRAL,NETRAL,NETRAL,BURUK,BURUK,1,0
Sesak banget tempatnya,NETRAL,NETRAL,NETRAL,BURUK,NETRAL,1,0
"Sesak banget, ngak ada udara",NETRAL,NETRAL,NETRAL,BURUK,BURUK,2,0
Sesuai dengan apa yang kami mau,NETRAL,NETRAL,NETRAL,BAGUS,BAGUS,4,1
"Sesuai dengan restoran yang mengusung makanan nusantara. Rasanya benar-benar enak. Konsistensi rasa, ukuran dan tatanan makanan benar-benar ala bintang 5.",BAGUS,NETRAL,NETRAL,BAGUS,NETRAL,5,1
Sesuai ekspektasi,NETRAL,NETRAL,NETRAL,BAGUS,BAGUS,5,1
Sesuai kata-kata orang,NETRAL,NETRAL,NETRAL,BAGUS,BAGUS,5,1
"Setelah kedua kali datang ke tempat ini, saya memutuskan untuk melakukan review untuk restoran ini.

Pro: Pelayanan yang tangkas, daging dan side dish variasi. Friendly staff.
Cons: Sejauh ini belum menemukan masalah yang signifikan.

Overall rating puas dan bakal return soon or later.",BAGUS,NETRAL,NETRAL,BAGUS,BAGUS,5,1
Setiap hari ada promosi,NETRAL,NETRAL,NETRAL,BAGUS,BAGUS,5,1
"Setiap makan disini si pelayan pasti ada yang lupa masukin ke sistem. Hari ini pun aku take away nasi ayam, ayamnya lupa... aku rasa ini restoran pasti mau untungnya doang ??",NETRAL,NETRAL,NETRAL,BURUK,BURUK,2,0
"Siapa pun yang memiliki restoran ini tidak membayar pelayan mereka dengan baik, atau tidak melatih mereka dengan baik. Sangat kasar, dan bertindak seolah-olah kita adalah binatang di kebun binatang. Makanan adalah layanan yang sangat baik dan sangat menyebalkan. Jangan datang ke sini kecuali jika Anda ingin kecewa",NETRAL,NETRAL,NETRAL,BURUK,BURUK,2,0
Sistem antrian yang tidak teratur. tidak mengutamakan waiting list. Hanya melihat jumlah orang yg datang sesui dengan meja yg tersedia. Very bad service. Like a disaster.,NETRAL,NETRAL,NETRAL,BURUK,BURUK,1,0
So far so good sampe saya nemu 2 helai rambut dalam spaghettinya?? it just ruined my appetite karena makanannya gak higienis padahal sebelum-sebelumnya sudah sering order di Amyrea dan gapernah ada masalah sama sekali,BURUK,BAGUS,BAGUS,BURUK,NETRAL,1,0
"SO GOOD!!! SEAFOOD ENAK BGTTTTTT!!!! cuy. Aku pesen kepitting telor saos singapore, udang bakar, kerang dara rebus. Kepiting nya enak bgt saosnya gurih manis gitu. Kerang dan udangnya juga fresh dan enak. Puas bgt deh. Harganya 470 rb an total semua. worth to try bakal balik lagi pokoknya.

Pelayanan cepet, tmpt gede dan bersih, ada ac. Ga ada lalat sama sekali.",BAGUS,NETRAL,NETRAL,NETRAL,NETRAL,5,1
"Spv nya sangat mengecewakan, tidak menghargai pembeli. Mending cari yg lain deh dari pada disni pelayanan dari spv nya tidak memberi kesan ramah sama sekali seakan akan tidak membutuhkan pelanggan,kapok saya belanja disini",NETRAL,NETRAL,NETRAL,BURUK,BURUK,1,0
Staf melayani dengan maksimal. sangat suka mengunjungi rumah makan ini. makanannya juga enak dan harus dicoba,BAGUS,NETRAL,NETRAL,BAGUS,BAGUS,5,1
"Staf sangat ramah, senang bisa menghabiskan makan malam disini",NETRAL,NETRAL,NETRAL,BAGUS,BAGUS,5,1
Staf tidak profesional. datang dan pergi begitu saja tanpa melihat dan mengambil piring kosong,NETRAL,NETRAL,NETRAL,BURUK,BURUK,2,0
Staf tidak profesional. datang dan pergi begitu saja tanpa melihat dan mengambil piring kosong,NETRAL,NETRAL,NETRAL,BURUK,BURUK,1,0
Staff baik,NETRAL,NETRAL,NETRAL,BAGUS,BAGUS,5,1
"Standar banget rasanya. Makan berdua pakai nasi putih 2, 1 ayam taliwang, satu porsi perkedel jagung, satu teh manis dan satu es kong tape Rp 137.500",BURUK,NETRAL,NETRAL,NETRAL,NETRAL,1,0
Stay away!,NETRAL,NETRAL,NETRAL,BURUK,NETRAL,1,0
Suasana dan tempat yang indah. makanan tidak pernah mengecewakan dengan banyaknya hidangan yang tersedia. semua makanan yang dihidangkan enak. apalagi ikan bandeng dan sambal khas nya,BAGUS,BAGUS,NETRAL,NETRAL,NETRAL,5,1
"Suasana ruangan sangat panas, harus menggunakan AC",NETRAL,NETRAL,NETRAL,BURUK,NETRAL,2,0
Suasananya enak banget. Alam banget. Jd bs rehat sejenak dr hiruk pikuk kota. Kids friendly jg. Toilet bersih. Kopinya enak2. Aku suka Liberica (panas/dingin enak). Es teh manisnya pekatttt banget dan banyak. Suka.,BAGUS,NETRAL,NETRAL,BAGUS,BAGUS,4,1
"Suasananya romantis, pas banget suasananya",NETRAL,NETRAL,NETRAL,BAGUS,BAGUS,5,1
suasanya enakk bgt! + pelayanan nya oke bgt sih!,BAGUS,NETRAL,NETRAL,BAGUS,BAGUS,5,1
"Sudah beberapa kali makan di tempat ini, cuma kali ini rasanya kurang mantap dibanding biasanya mungkin karena ramai.",BURUK,NETRAL,BURUK,BURUK,BURUK,1,0
"Sudah berkali-kali mengunjungi restoran Indonesia ini. Kapan pun saya ingin mendapatkan berbagai macam masakan Indonesia, ini adalah salah satu tempat untuk dikunjungi.",BAGUS,NETRAL,NETRAL,NETRAL,NETRAL,5,1
Sudah ditelepon ngak diangkat,NETRAL,NETRAL,NETRAL,BURUK,BURUK,1,0
"Sudah lah datang jauh-jauh, rasanya sangat mengecewakan. jadi berpikir dua kali untuk kembali kesini",BURUK,NETRAL,NETRAL,BURUK,NETRAL,1,0
"Sudah lama baru ke sini lagi dulu pernah sekali tapi kecewa dengan makanannya, nasi liwet kering, gurame goreng hambar, tempe asem, sop iga ga jelas antara sop apa pindang, kerupuk kulit sudah alot",BURUK,NETRAL,NETRAL,NETRAL,NETRAL,2,0
Sudah nyobain di 2 tempatnya mat lengket.,NETRAL,NETRAL,NETRAL,NETRAL,NETRAL,5,1
"Sudah nyobain di 2 tempatnya mat lengket.
Ni ayam enak banget sihh, bisa ampe abis 5 potong sendiri! Bukan rakus, tp memang ukurannya kecil2 dan yang pasti ini Ayam Kampung! Rasa memang tidak diragukan, cuman memang kadang pelayanannya suka lama kalau lagi rame bgt! Tapi ini tempat memang tidak pernah sepi sih, baik yang dekat fly over or traffic lamp",BAGUS,NETRAL,BAGUS,NETRAL,NETRAL,5,1
"Sudahlah panas, tidak ada angin, satu ruangan dengan dapur pula. Sangat tidak nyaman makan disini",NETRAL,NETRAL,NETRAL,BURUK,BURUK,2,0
Suka banget datang ke sini,BAGUS,NETRAL,NETRAL,BAGUS,BAGUS,4,1
"Suka banget makan disini, makanannya khas jawa banget.. jadi kangen pulang ke Jawa",BAGUS,NETRAL,NETRAL,NETRAL,NETRAL,5,1
Suka banget nih makan disini.. bihun goreng telornya manteb ????????????,BAGUS,NETRAL,NETRAL,NETRAL,NETRAL,5,1
Suka banget sama decornya. Cantik. Pelayanannya juga ramah dan cepet.,NETRAL,NETRAL,NETRAL,BAGUS,BAGUS,5,1
"Sukaaaaa banget. Porsinya lumayan gede, rasanya udah mirip banget sama yg di Medan. Tekstur mienya kecil2 halus gitu",BAGUS,NETRAL,NETRAL,NETRAL,NETRAL,5,1
Sulit mendapatkan reservasi ketika weekend. ikan bandeng sangat enak dan harum. ini merupakan menu pesanan berulang kami satu keluarga,BAGUS,NETRAL,BAGUS,NETRAL,NETRAL,4,1
"sumo boo!! yay dessert yg lutchu sangat dan sangat silky, tempat yg nyaman dan cocok buat santai, good lah pokoknya, ohh ya untuk pelayanannya yg ramah dan murah senyum ??",BAGUS,NETRAL,NETRAL,BAGUS,BAGUS,4,1
"Super duper bad experience datang ke resto ini, pertama kali mengalami service dari resto seburuk ini, 1. Pelayan yang sangat susah dipanggil, lebih melayani meja meja yang mereka kenal. (Bisa 20 menit baru disamperin) 2. Perlakuan tidak fair, 2 teman tidak boleh masuk dengan alasan lagi ada sweeping dan media akan datang diwaktu jam 10 malam (?) sementara diwaktu bersamaan orang lain boleh masuk (?) yang mengaku mereka teman owner. ??????? Kalau tidak mempunyai kemampuan memperlalukan customer dengan baik, lebih baik difikir lagi ya. Kan kita bayar bukan datang dan makan minum gratis. Ga akan pernah balik ke restoran ini lagi :) sekian",NETRAL,NETRAL,NETRAL,BURUK,BURUK,1,0
Super duper slow,NETRAL,NETRAL,NETRAL,BURUK,BURUK,1,0
"Suprise dinner suami memutuskan kesini, tetapi tidak diberikan pelayanan terbaik. Pelayan terlihat sibuk tetapi hanya terlihat beberapa meja. setelah memesan makanan pelayan bilang segera kembali, tetapi setelah 10 menit tidak datang juga, lalu kami pergi meninggalkan tempat ini",NETRAL,NETRAL,NETRAL,BURUK,BURUK,2,0
Susah banget mau cari tempatnya,NETRAL,NETRAL,NETRAL,BURUK,NETRAL,2,0
Susah mendapatkan parkir ketika ada event,NETRAL,NETRAL,NETRAL,NETRAL,NETRAL,2,0
"Sy dtg ke resto 6 feb jam set 10. Ngaco bgt pelayanan nya, mbak2nya ga ramah mlh nyolot. Uda nunggu mkanan 45 menit, ditny mkanan nya mn mlh buang muka. Tlg mbak2nya diajarin sopan santun dkit ya. Klian jual mkanan percuma kalo pelayanan nya ky gt. Org ga akn mau dtg lg ke resto. Mkanan juga biasa aja. Syg mbak2nya ga pke tag nama, kalo ada tag nama pasti uda sy publish di sini",NETRAL,NETRAL,NETRAL,BURUK,BURUK,1,0
"Sy dtg ke resto 6 feb jam set 10. Ngaco bgt pelayanan nya, mbak2nya ga ramah mlh nyolot. Uda nunggu mkanan 45 menit, ditny mkanan nya mn mlh buang muka. Tlg mbak2nya diajarin sopan santun dkit ya. Klian jual mkanan percuma kalo pelayanan nya ky gt. Org ga akn mau dtg lg ke resto. Mkanan juga biasa aja. Syg mbak2nya ga pke tag nama, kalo ada tag nama pasti uda sy publish di sini",NETRAL,NETRAL,NETRAL,BURUK,BURUK,1,0
"Sy dtg ke resto 6 feb jam set 10. Ngaco bgt pelayanan nya, mbak2nya ga ramah mlh nyolot. Uda nunggu mkanan 45 menit, ditny mkanan nya mn mlh buang muka. Tlg mbak2nya diajarin sopan santun dkit ya. Klian jual mkanan percuma kalo pelayanan nya ky gt. Org ga akn mau dtg lg ke resto. Mkanan juga biasa aja. Syg mbak2nya ga pke tag nama, kalo ada tag nama pasti uda sy publish di sini",NETRAL,NETRAL,NETRAL,BURUK,BURUK,1,0
Syukaaaaa bingitsss.. tempatnya adem.. harga juga ramah di kantong.,NETRAL,NETRAL,NETRAL,BAGUS,NETRAL,5,1
"Tahun lalu sering kesini enak bgt,tp kmrn kesini lg kok beda??kok jd biasa aja skrg :( ga segurih dulu mie ayam bakso & bakso kuah sama"" 14k .. ga akan order mie ayam lg .. huff kuciwa",BURUK,NETRAL,NETRAL,NETRAL,NETRAL,1,0
"tapi service nya 0, semua mbaknya di ikhousha jutek semua, dan gak ada yang ngomong terima kasih sama sekali, malah pas liat kita udah mau balik, ada yang pura-pura nulis padahal ada yang mesen juga gak, mau bayar pun mbaknya tetep nyolot banget, dan pas awal nanya ttg pemakaian gold, mbaknya gak ksh tau kl hrs unlock dulu dll, pantes aja yg di pluit sepi, servicenya JELEK BANGET",NETRAL,NETRAL,NETRAL,BURUK,BURUK,2,0
"Tapi untuk ""kopi kebun"" ga berasa kopinya, encer banget kebanyakan air, susunya juga kurang berasa. Jual tempat doang sih ini yg adem kalo dateng siang pun.",BURUK,NETRAL,NETRAL,BAGUS,NETRAL,1,0
Taraf pedas sambelnya gak sesuai ekspektasi. Saya pesan sambal terasi malah gak terasa terasinya. Katanya level 3 tapi malah lebih pedas saos ABC. Dan lagi.. harganya sedikit berlebih. Gak mau makan disini lagi,NETRAL,BURUK,NETRAL,BURUK,NETRAL,1,0
